Device,Time,Date,(1) Map,(1) Waits,(1) Shows,(1) Tips,(1) Bonus,(1) Game,(2) Not work as expected?,If yes...,(3) Influence?,If yes...,(4) Enough time?,If no...,(5) Overall Experience,(5a) Why?,(6) Merchandise Locations,(6a) What drove decision?,(7) Amount on merchandise,(8) F&B Locations,(8a) What drove decisions?,(9) Amount on F&B,(10) Meals eaten,(11) Attractions visisted,(13) Experience #1,(13) Experience #2,(13) Experience #3,(14) Age of user,(14) Gender of user,(15) Paper map?,(16) Paper schedule?,(17) Get lost?,(18) How closely did you follow plan?,(18a) What diverted original plans?,(19) Ride because of low wait times?,(19a) If yes....,(20) Get fast passes?,(20a) If yes...,(20c) Use them?,(20c) If no...,(21) Group split?,(21a) If yes...,(21b) Who kept the device?,(22) Other comments?
189,15:32:00,4/22/2011,2,1,0,1,1,0,no,,no,,no,,poor,encorbrant/ peu utile,My group has not purchased any merchandise at the disneyland paris resort today,,,Disney blockbuster cafe,food offerings,2,lunch and afternoon snack,"le pays des contes de fees, captain eo, studio tram tour, rock n roller coaster, tower of terror, playhouse disney live on stage",Moteurs action stunt show,tower of terror,rock n roller coaster,28,Male,no,no,never,does not apply,,no,,yes,tower of terror,yes,,no,,,encorbraint/ peu utile
190,14:49:00,4/26/2011,4,7,4,5,0,6,No,,yes,,no,,Very Good,,The Emporium,Merchandise offerings,110,Fuente del oro restaurante,Food offerings,40,Breakfast and Lunch,"Le pays des contes de fees, alice's Curious Labyrinth, its a small world",Its a small world,Le train der cirque, ,34,Female,Yes,No,Never,Closely,Long wiats,Yes,Its a small world,yes,Buzz Lightyear,Yes,,No,,,Very useful
190,16:43:00,4/22/2011,1,2,1,1,1,1,yes,,no,,no,,just okay,3,,,,,food offerings,30,lunch  ,"art of disney animation, cinemagique, armageddon, moteurs action stunt show",rock n roller coaster,nemo,parade,28,female,yes,yes,never,closely,long waits,,,yes,,yes, ,no, ,,"peu ehe bien mais n a pas fonctionne, toules la journee' mais peut etre tres utile"
192,20:10:00,4/23/2011,7,1,1,7,1,1,No, ,No,,Yes,,Good,Por la auda,Walt Disney Store,Nothing,50,Restaurant en coulisse,,,,,,,,,,,,,,,,,,,,,,,,
192,20:10:00,4/24/2011,6,5,5,3,3,4,yes,se bloqueo,no,,no,,good,,,Proximity,40,,,,,,,,,,,,,,,,,,,,,,,,,
192,19:08:00,4/25/2011,7,5,6,4,3,3,Yes,,No,, ,,Excellent,,"Indiana Jones adventure outpost, plaza west shop", ,140,,Counter service vs table service,50,,Its a small world,Space Mountain, , ,15,Male,Yes,No,Never,Loosely,Tired Children,No,,No,,Yes,,No,,,
192,19:35:00,4/28/2011,5,7,7,6,7,5,No,,Yes,Le bonus dons le restaurant,Yes,Pos tous les bonus malteureusemoat,Very Good,Locarte etout trap petit mouque des infos,,Store look and feel,200,Restaurant Hakuna Matata,Food offerings,40,Lunch and afternoon snack,La Cabane des robinson,Pirates of the Carribean,Star tour,,37,Female,No,No,Never,Does not apply did not have a plan,,Yes,Pirates ,Yes,Buzz,No,Nous etious trop tard,Yes,Ou a du chanjer les courtes des bebe,on la goder ouc has et les bebes,plus de fonccionns fast pass
192,20:30:00,4/29/2011,3,4,4,0,0,5,Yes,Plus de batteria,no,,no,,good,,Indiana Jones Adventure outpost,"Merchandise offerings, store look and feel",150,Fuente Del Oro restautante,Food offering and price,60,Lunch and Dinner,"La cabaned des robinson, alic'es curious labyrinth, Art of disney animation, cinemagique",Parade,Pirates of the carribean,Autopia,31,Female,yes,yes,Never,Does not apply did not have a plan,other fien,no,,no,,,,,,,
192,14:00:00,4/30/2011,6,4,0,3,4,0,No,,No,,No,Not enough time,Good,,"Indiana Jones Adventure OUtpost, Thunder Mesa Mercantile, La Girafe Curieus, Les Legends de hollywood, art of animation, Disney store, World of toys","Merchandise offerings, store look and feel, proximity",250,"Agrabah Cafe Restaurant, Colonel Hathi's Pizza Outpost, Fuente del oro restaurante, restaurant Hakuna Matat, Pizzeria Bella Notte, Disney Blockbuster Cafe","Food offerings, proximity, price",250,"Lunch, Dinner","Alice's Curious Labyrinth, its a small world, flying carpets over agrabah, studio tram tour, Moteurs Action Stunt show",stunt action,buzz lightyear,tower of terror,41,Male,Yes,Yes,Never,Loosely,"Long waits, tired children",yes,carousel,no,,,,No,,,
192,12:00:00,4/22/2011,,,,,,,,,,,,,,,,,,,,,,,,,,,,,,,,,,,,,,,,,,No pm surveys available
193,19:10:00,4/23/2011,4,7,0,0,5,1,No, ,No,,No,,Good,,,Proximity,10,Disney Blockbuster cafe,Proximity and other,31.8,lunch and afternoon snack,"Art of disney animation, stitch live, studio tram tour, armageddon, playhouse disney live",studio tram tour,armageddon,,43,M,No,No,Never,loosely,Long waits,Yes,studio tram tour,Yes,aladdin,No,Horanio cruzado,No,,,No
193,14:40:00,4/24/2011,5,3,5,0,0,0,yes,zoom,no,,no,,just okay,Could not see due to sunlight,Tower hotel gifts,Proximity,50,Pizzeria bella notte,,,,,,,,,,,,,,,,,,,,,,,,
193,16:00:00,4/24/2011,,,,,,,yes,appareil bloque,yes,,no,,,,,,,,Reservation,,Lunch and dinner,,,,,,,,,,,,,,,,,,,,,
193,16:55:00,4/25/2011,5,0,3,2,4,0,No,,No,,No,Partially,Just Okay,,My group has not purchased any merchandise at the Disneyland Paris resort today,,,My group has not purchased any meals or snacks at the Disneyland Paris resort today,,2.5,afternoon snack,"Stitch live, flying carpets over agrabah, cinemagique, rock  roller coaster, playhouse disney live on stage",rock n roller coaster,stitch live,cinemagique,39,Male,Yes,No,Never,Loosely,tired children,Yes,,No,,,,No,,,
193,18:00:00,4/26/2011,7,7,5,4,7,7,No,,No,,Yes,,Excellent,,My group has not purchased any merchandise at the Disneyland Paris Resort today,,,Disney Blockbuster Cafe,Price,56,Breakfast and Lunch,"Alice's Curious Labyrinth, its a small world, stitch live, cenemagique, rock n roller coaster, tower of terror, moteurs action stunt show",Tower of terror,rock n roller coaster,Space mountain,15,Male,No,No,Never,"Does not apply, did not have a plan",Long wiats,No,,Yes,Tower of Terror,Yes, ,No,,,Tres bon appareil
193,,4/22/2011,7,7,7,4,4,2,no,,yes,,no,,good,,My group has not purchased any merchandise at the disneyland paris resort today,,,My group has not purchased any meals or snacks at the disneyland paris resort today,,50,Lunch,"Le pays des contes de fees, alice's curious labyrith, stitch live, moteurs action stunt show",moteurs action stunt show,alice's curious labyrinth,stitch live,44,Male,no,no,never,closely,long waits,no,,no,,,,no,,,refections des attractions plus precise nataments par ordhe. d'attente ou faire un circuit er fonction de nos attentes
194,20:20:00,4/23/2011,7,6,4,2,2,3,Yes,It stopped working one time,No, ,Yes,,Very Good,,La Birafe Curieuse,Proximity,60,Cafe Hyperion,Proximity,44,Lunch,"Armageddon, rock n roller coaster, tower of terror, moteurs actions stunt show",tower of terror,rock n roller coaster,moteurs action stunt show,18,M,Yes,No,once,Does not apply did not have a plan,,Yes,Rock n roller coaster,yes,tower of terror,yes,,No,,,
194,17:55:00,4/25/2011,5,7,5,6,7,3,No,,Yes,,Yes,,Excellent,,My group has not purchased any merchandise at the Disneyland Paris Resort today,,,My group has not purchased any meals or snacks at the Disneyland Paris resort today,,,Breakfast,"Le pays des contes de fees, alice's curious labyrinth, its a small world, captain eo, studio tram tour, cinemagique, rock n roller coaster, tower of terror",rock n roller coaster,studio tram tour,tower of terror,25,Male,Yes,Yes,Never,Closely,Long waits and Bonus,Yes,Rock n roller coaster and indiana jones,no,,Yes,,No,,,"Attractions option, you should indicate the way to take for an attraction"
194,,4/26/2011,,,,,,,,,,,,,,,,,,,,,,,,,,,,,,,,,,,,,,,,,,Recure securite
194,20:05:00,4/28/2011,5,5,0,2,0,2,Yes,Sortu de p'application,Yes,,No,,Good,,My group has not purchased any merchandise at the Disneyland Paris Resort today,,,My group did n ot purchase any meals or snacks at the Disneyland paris resort today,,,"breakfast, lunch and evening snack","La Cabane des Robinson, Le pays des Contes de fees, Alice's Curious Labyrinth, its a small world",Its a small world,Alice's Curious Labyrinth,,40,Male,Yes,Yes,Never,closely,Tired children,Yes,,No,,,,No,,,
194,20:45:00,4/29/2011,4,4,3,3,0,0,No,,No,,No,,Just okay,,My group has not purchased any merchandise at the Disneyland Paris Resort today,,,Restaurant Hakuna Matata,Food offerings  ,30,Lunch,"Its a small world, Captain EO",Space Mountain,Pirates of the carribean,Its a small world,34,Female,yes,yes,once,Does not apply did not have a plan,Long waits,no,,yes,Space mountain,yes,,yes,Different ages,Me,l'ouhl papier et ties suffisant
194,21:30:00,4/30/2011,7,7,2,2,7,2,No,,No,,Yes,,Excellent,Efficience pour le t qs d'attee,My group has not purchased merchandise at the Disneyland Paris Resort Today. ,,,Restaurant Hakuna Matata,Bonus,,afternoon snack,Alice's curious labyrinth,Peter pan,Pirates of the carribean,small world,32,M,Yes,Yes,Never,Does not apply - Did not have a plan,,Yes, ,No,,No,,No,,,
194,21:30:00,4/30/2011,7,7,2,2,7,2,No,,No,,Yes,,Excellent,Efficiece pour les t ps d'atteb,My group has not purchased any merchandise at the Disneyland Paris Resort Today,,,Restaurant Hakuna Matata,bonus,,afternoon snack,Alice's Curious Labyrinth,Peter pan,pirates of the carribean,small world,32,M,Yes,Yes,Never,Does not apply did not have a plan,,Yes,,No,,No,,No,,,
194,21:00:00,4/27/2011,7,5,5,0,0,2,no,,no,,,,Very Good,porque es de mucha ayudo,,,,,,,Lunch  ,"La pays des contes de fees, Alice's Curious Labyrinth, Its a small world, Captain EO",Peter pan,Childrens world, ,17,Female,no,no,never,loosely,other,yes,Alicia,,,,,No,,,Muy Biene
194,18:40:00,4/24/2011,0,7,7,0,7,7,no,,no,,yes,,excellent,iclee geniale,Disney Store,,,"Buzz Lightyear pizza planet, disney blockbuster cafe",food offerings and price,60,"morning snack, lunch, afternoon snack and evening snack","Alice's curious labyrinth, stitch live, tower of terror, playhouse disney live on stage",tower of terror,Big thunder mountain railroad,stitch live,44,Female,no,no,once,closely,long waits and bonus,yes,stitch live and tower of terror,no,,,,no,,,genial super idee pensez a preusir fuelque chose peit le porter er il manque les restaurnants. Fais wrihinuez c'st super
195,18:14:00,4/23/2011,7,6,7,0,5,7,No,,Yes,,Yes,,Very Good,Could be told us about hight restrictions on childrens rides,My group has not purchased any merchandise at the Disneyland Paris Resort Today,,,Cafe Hyperion,Proximity and bonus,35,lunch and afternoon snack,"Its a small world, Rock n roller coaster, tower of terror, moteurs action stunt show",Rock n roller coaster,Moteurs action stunt show,its a small world,30,M,No,No,Never,Does not apply did not have a plan,,Yes,Phantom Manor,Yes,"Rock n roller coaster, space mountain and buzz lightyear",Yes, ,No,,,Few fast pass. Only one during the whold day
195,18:25:00,4/25/2011,2,2,3,1,1,1,Yes,Shows not well indicated,Yes,Shows,No,,Poor,Not readable. I prefer a paper map,un peu partout,"Merchandise offerings, store look and feel and proximity",400,Don't know where,,30,lunch and afternoon snack,"Le pays des contes de fees, its a small world",Space mountain,its a small world,,40,Male,Yes,Yes,a few times,,,No,,Yes,Space mountain,Yes,,Yes,pour space mountain,same person,I wouldn't use it!
195,15:00:00,4/28/2011,4,5,3,4,5,4,No,,Yes,,No,,Good,,"The Emporium, Walt Disney Studios Store","Store look and feel, proximity",50,My group did n ot purchase any meals or snacks at the Disneyland paris resort today,,,,,,,,,,,,,,,,,,,,,,,,
195,18:30:00,4/30/2011,3,3,0,0,0,2,Yes,Electique,No,,No,,Poor,,My group did not purchase any merchandise at the Disneyland Paris Resort today,,,,,,,,,,,,,,,,,,,,,,,,,,,
196,21:45:00,4/23/2011,7,7,3,0,0,0,Yes,No Battery,Yes,,No,,Very Good,,?,Store look and feel,,,Proximity,50,Afternoon Snack,"Stitch, Flying Carpets over Agrabah, Studio Tram Tour, Armageddon, Tower of terror, playhouse disney live",Armageddon,Studion Tram Tours,Tower of terror,36,F,No,No,Never,Closely,Bonuses,No,,No,,,,Yes,2 to Tower of Terror and Armageddon,Same person,Could tell you which rides are for young children and one more suited for older ones
196,19:12:00,4/24/2011,3,0,0,0,0,1,Yes,Atha hes spectacle,yes,a cause du soleil,no,,just okay,,,,,Pizzeria bella notte,Proximity,,Lunch,"Le pays des contes de fees, its a small world",,,,42,female,yes,yes,a few times,Loosely,long waits,yes,tasses tournantes,no,,yes,,yes,renchez-vous le doir,,"to attraction, et spectacle introuuables"
196,18:20:00,4/25/2011,6,0,5,0,7,0,Yes,Standby made next show,Yes,Bonuses,Yes,,Very Good,"Compact, GPS, Bonuses","Walt Disney Studios store, art of animation",Proximity,50,,Bonus - Other,50,afternoon snack,,,,,34,Male,No,No,Never,Does not apply did not have a plan,long waits,Yes,its a small world,No,,No,not interested,No,,,
196,18:50:00,4/26/2011,,,,,,,,,,,,,,,,,,,,,,,,,,,,,,,,,,,,,,,,,,Rendu pan la securite
196,13:46:00,4/29/2011,,,,,,,,,,,,,,,,,,,,,,,,,,,,,,,,,,,,,,,,,,Returned to cast member at Studios (ticketing)
196,14:50:00,4/30/2011,7,7,2,1,7,7,No,,No,,No,,Good,,"The Emporium, Thunder Mesa Mercantile, la Girafe Curieuse, walt disney studios store",Store look and feel,200,"Buzz Lightyears pizza planet, cowboy cookout barbeque, fuente del oro restaurante, cafe hyperion",,,,,,,,,,,,,,,,,,,,,,,,
196,19:20:00,4/22/2011,3,5,4,1,6,7,no,,no,,yes,,very good,,My group has not purchased any merchandise at the disneyland paris resort today,,,My group has not purchased any meals or snacks at the disneyland paris resort today,,,,"Stitch live, Studio tram tour, rock n roller coaster, tower of terror",Rock n roller coaster,tower of terror,,12,Female,no,no,never,does not apply did not have a plan,,yes,rock n roller coaster,yes,tour de la feieur,yes,,no,,,tres pratique
197,20:20:00,4/23/2011,,,,,,,,,,,Yes,,,,,,60,Pizzeria Bella Notte,Price,40,Dinner,Captain EO,Les Poupees,Tower of terror,Pirates of the Carribean,14,F,No,No,Never,Does not apply did not have a plan,,Yes,,No,,,,No,,,
197,18:25:00,4/24/2011,2,1,0,2,3,3,no,,no,,yes,,good,its temps attente inexate,Plaza west shop,merchandise offerings and store look and feel,200,Buzz lightyears pizza planet,"food offerings, price",100,lunch,"le pays des contes de fees, its a small world, Captain EO",Train de mine,its a small world,,46,Male,yes,no,once,Does not apply did not have a plan,,no,,yes,train de mine,yes,,no,,,
197,19:30:00,4/29/2011,7,7,7,,1,1,No,,yes,,nyes,,good,,"Indiana jones adventure outpost, world of toys",,150,,,,,,,,,,,,,,,,,,,,,,,,,
197,16:35:00,4/30/2011,6,4,5,6,6,5,No,,No,,No,didnt need,good,,,Merchandise offerings,30,,Food offerings wait times proximity and price,50,breakfast and lunch,"Studio tram tour, tower of terror, Moteurs, rockn roller coast armageddon",Rock n roller coaster,Moteurs action stunt show,Tram tour,12,Female,Yes,Yes,Never,Does not apply - Did not have a plan,,No,,No,,,,Yes,Ballade en familla,Moi,None
197,18:35:00,4/27/2011,6,5,0,3,5,6,yes,wait times werent accurate,no,,yes,,Excellent,Very good for someone new to the park,My group has not purchased any merchandise at the Disneyland Paris resort today,,,,food offering,70,lunch,"le pays des contes de fees, alice's curious labyrinth, its a small world",,,,32,Female,no,no,never,does not apply did not have a plan,long waits and tired children,no,,no,,,,no,,,
197,15:43:00,4/22/2011,7,7,7,7,7,7,no,,no,,yes,,excellent,because its very useful and helpful,,,,Restaurant en coulisse,Bonus,59,Morning Snack and lunch,"alice's curious labyrinth, Its a small world, captain eo, art of disney animations, flying carpets over agrabah, studio tram tour, rock n roller coaster, playhouse disney live on stage",Playouse disney live on stage,tower of terror,rock n roller coaster,39,Male,no,no,never,exactly,,no,,no,,,,,,,Brilliant device to use for trips
198,19:15:00,4/24/2011,6,7,6,1,1,5,No,,yes,tiempos de espera,no,,very good,Porque nos ayudo,Plaza west shop,Proximity,250,"Buzz lightyears pizza planet, and Disney Blockbuster Cafe",,,,,,,,,,,,,,,,,,,,,,,,
198,20:43:00,4/29/2011,7,7,2,5,7,3,no,,yes,oi la fant par rapport,yes,touis inferncile,very good,utile,Tower hotel gifts,Merchandise offerings 60,,,,,Morning snack,"its a small world, captain EO, tower of terror",Tower of terror,its a small world,,32,Male,no,no,never,Exactly,Other - on a fait notie parcours plan le machine,yes,,no,,,,no,,,Appaierl 1er fois dive 2ene' tres simple d'utilisation
198,20:45:00,4/30/2011,4,7,7,5,2,4,No,,Yes,,No,,Very Good,Facile,Thunder Mesa Mercantile,,150,Cafe Hyperion,,,,,,,,,,,,,,,,,,,,,,,,
198,12:58:00,,7,6,6,6,6,6,Yes,,No,,Yes,,Very Good,,My group has not purchased any merchandise at the Disneyland Paris Resort today,,,My group did not purchase any meals at the Disneyland Paris Resort today,"Wait Time, Price",60,Lunch and dinner,La cabone des robinson,,,,,,Yes,Yes,Never,,,,,,,,,,,,
198,17:30:00,4/22/2011,7,7,5,3,3,2,no,mise a jour trop fente,no,,no,,very good,,My group has not purchased any merchandise at the disneyland paris resort today,,,My group has not purchased any meals or snacks at the disneyland paris resort today,,,,Its a small world,Pirates of the carribean,haunted mansion,its a small world,26,Male,no,no,never,closely,long waits ,yes,its a small world,yes,buzz lightyear,yes,,no,,,mettre creneaux fast pass et plus de questions pour les jeux
200,,4/23/2011,6,7,6,0,6,6,No,,Yes,,Yes,Temps d'attente,Very Good,Fast Pass, The Emporium,Proximity,10,Disney Blockbuster Cafe,Food offerings,,Lunch,,Nemo,,,33,F,Yes,Yes,A Few Times,Loosely,Long Waits,Yes,,No,,,,No,,,
201,12:00:00,4/23/2011,1,0,0,0,0,0,Yes, ,No,,No,,Poor,,My group has not purchased any merchandise at the Disneyland Paris Resort today,,,,Proximity,25,"Lunch, evening snack","Stitch Live, Cinemagique, Armageddon, Tower of terror",Aerosmith,Tower of terror,Space Mountain,34,F,No,No,Never,Does not apply did not have a plan,Long Waits,No,,Yes,Aerosmith,Yes,,No,,,
201,17:46:00,4/24/2011,,,,,,,Yes,,yes,,yes,Ascen seur,V ery good,,My group has not purchased any merchandise at the Disneyland Paris Resort today,,0,My group has not purchased any meals or snacks at the Disneyland paris resort today,Reservation,110,Lunch and afternoon snack,"Rock n roller coaster, tower of terror",Rock n roller coaster,Ascenseur,Crush's Coaster,33,Female,no,no,never,Exactly,long waits,yes,Armageddon,yes,Rock n roller coaster,yes,,yes,enfants,moi,Super
201,20:15:00,4/25/2011,6,7,0,0,0,0,No,,Yes,,,,Very Good,Very Good,The Emporium,Merchandise offerings,50,My group has not purchased any meals or snacks at the Disneyland Paris Resort today,,,,"Stitch live, flying carpets over agrabah and playhouse disney",Space mountain,parade,,34,Male,No,No,Never,Closely,Long waits,No,,No,,,,No,,,None
201,21:33:00,4/26/2011,7,2,1,1,4,2,Yes,?,Yes,Le sque temps trop long,No,treups trop court pour alleda leudio l eiu dique,Good,La cade pl utile nous pas rillecuer aiadageeto,My group has not purchased any merchandise at the Disneyland Paris Resort today,,,,,,,,,,,,,,,,,,,,,,,,,,,Survey not completed
201,22:20:00,4/30/2011,6,6,5,0,5,6,No,,Yes,,No,Nous etous dars l'autre parc,Very Good,,My group has not purchased any merchandise at the Disneyland Paris Resort today,,,,"Bonus, reservations",70,afternoon snack and dinner,"Stitch live, flying carpets over agrabah, studio tram tour, armageddon, tower of terror, moteurs action stunt show",Tower of terror,Stitch live,Moteurs action stunt show,8,Female,Yes,Yes,Never,loosely,Long waits,yes,Buzz lightyear,yes,tower of terror and rock n roller coaster,Yes,,No,,,les toilles des aufaut seraioit un plur
202,19:06:00,4/24/2011,,,,,,,,recte parfois (rare),yes,Quand le bonus arrivait ou temps d'attent peus altrach,Yes,,Excellent,"Facile d'utilisation, grace au bonus - resto",,Bonus,,Buzz Lightyears Pizza Planet,Bonus,12.95,Afternoon snack,"Captain EO, Rock n roller coaster, tower of terror",tower of terror,RC Racer,Space Mountain,26,Female,no,no,never,Does not apply did not have a plan,long waits,yes,la tour and Rock n roller coaster,yes,indiana ones,yes,,yes,pas les sensations ferhes,la personne qui a le plus utilise l'appared,Tres bien
202,19:05:00,4/25/2011,6,7,4,3,6,6,No,,Yes,,Y,,Very Good,,Walt Disney Studios store,"Merchandise offerings, store look and feel  ",100,Restaurant en coullise,,,,,,,,,,,,,,,,,,,,,,,,
202,19:20:00,4/26/2011,5,6,6,,,1,No,,Yes,,No,,Excellent,,,Other,0,Restaurant en coulisse,Wait times ,30.5,Lunch,"Studio Tram tour, cinemagique, armageddon, rock n roller coaster, tower of terror, moteurs action stunt show",Studio tram tour,tower of terror,armageddon,11,Male,No,No,Once,Closely,Long waits,Yes,,No,,No,,Yes,grandparent,moi,none
202,19:06:00,4/27/2011,2,3,3,2,3,1,yes,battery low,,,no,,,just okay,,,0,My group has not purchased any meals or snacks at the Disneyland Paris Resort today,Counter service vs table service,0,afternoon snack,,Autopia,,,30,Female,,yes,a few times,loosely,long waits and tired children,no,,no,,,,no,,,
203,19:00:00,4/25/2011,5,,2,4,2,1,No,,Yes,,No,,Very Good,,,,,,,,,,,,,,,,,,,,,,,,,,,,,
203,18:50:00,4/26/2011,7,7,6,2,6,4,Yes,"scrolldown, battery wasn't good",Yes,,Yes,,Very Good,It was useful,"the emporium, disney store",Price,50,,"food offerings, price, wait times",2000,lunch afternoon snack and dinner,"Alice's curious labyrinth, its a small world, studio tram tour, armageddon, rock n roller coaster, tower of terror",space mountain,rock n roller coaster,Tower of terror,21,Female,yes,no,never,loosely,tired children,yes,haunted mansion,yes,,yes,,yes,wanting to go on different rides,,
203,19:40:00,4/27/2011,7,7,0,1,2,4,no,,no,,no,porque la 1st era despues de nuestra entrada,very good,,"The emporium, indiana jones adventure outpost, Walt Disney Studios store, Disney store","Merchandise offerings weather conditions, bonus",100,"Cafe Hyperion, Disney's Blockbuster cafe",Proximity and bonus,70,lunch and afternoon snack,Moteurs action stunt show,pirates of the carribean,crushes coaster,parachute,45,female,no,no,never,exactly,,yes,pirates of the carribean,no,,no,,,,,que haya mas fast pass en mas attracciones
204,21:15:00,4/23/2011,5,4,4,2,0,5,No,,No,,No,,Good,,My group has not purchased any merchandise at the Disneyland Paris Resort today,,,,,,,,,,,,,Yes,Yes,Never,Exactly,,Yes, ,No,,,,No,,,Device screen too dark
204,14:15:00,4/25/2011,7,7,0,4,7,1,Ys,Waiting times not accurate,Yes,Waiting times,No,,Very Good,Very useful,The Emporium,"Merchandise offerings, Store look and feel",70,Retaurant Hakuna Matata,Food offerings and price,26,Lunch  ,Flying carpets over agrabah,Orbitron,Buzz Lightyear,Flying Carpets over agrabah,32,Female,No,No,Never,Closely,Long waits and tired children,Yes,Orbitron,No,,,,No,,,"When you click on an attraction, it would be great to indicate waiting times (more usefule!)"
204,18:00:00,4/21/2011,,,,,,,,,,,,,,,,,,,,,,,,,,,,,,,,,,,,,,,,,,didn't have time to answer the survey
205,15:23:00,4/23/2011,6,6,7,4,4,4,No, ,Yes,,No,,Very Good,,,,,Restaurant en coullise,,0,,"Its a small world, armageddon, moteurs action stunt show",space mountain,indiana jones, ,23,M,Yes,Yes,Never,Closely,Long Waits,No,,No,,,,No,,,
205,20:05:00,4/25/2011,,,,,,,,,,,,,,,,,,,,,,,,,,,,,,,,,,,,,,,,,,Device returned by a cast member
205,21:25:00,4/26/2011,6,7,4,6,7,7,No,,Yes,,yes,,Very Good,Facile d utile,Plaza West Shop,Other- Avoir in souvenir,20,My group has not purchased any meals or snacks at the didnsyland paris resort today,,,,,,,,,,,,,,,,,,,,,,,,Survey not complete
205,13:10:00,4/29/2011,,,,,,,,,,,,,,,,,,,,,,,,,,,,,,,,,,,,,,,,,,"The device turned off for no reason, the guest was given the device no226 for the rest of the day"
205,19:30:00,4/30/2011,7,5,5,7,7,7,No,,No,,Yes,,Very good,bonne orientation et bonus sympio,The Emporium,Bonus,60,My group has not purchased any meals or snacks at the Disneyland Paris Resort today,,,,"La cabane des robinson, alice's curious labyrinth, its a small world","Buzz Lightyear,",Pirates,Indiana Jones,32,Male,No,No,Never,Does not apply - did not have a plan,"Long waits, bonus",Yes,Indiana Jones and Pirates,Yes,Buzz Lightyear,Yes,,Yes,attractions differente funtion age enfants,Monsieur or madame so defend,Super! Genial!
205,,4/28/2011,5,4,1,5,2,4,No,,Yes,,No,,Good,,,Proximity,60,Cowboy cookout barbeque and Restaurant Hakuna Matata,Proximity,70,Lunch,"Alice's Curious Labyrith, its a small world, Captain EO",Star tours,Captain EO,Its a small world,45,Male,Yes,Yes,Once,loosely,Tired children,Yes,Nautilus,No,,,,No,,,No
205,,4/27/2011,4,4,0,1,0,3,no,,no,,no,,just okay,de precisions concernant les attractions servent utiles: age por ex.,le re sais pes!,Merchandise offerings  ,50,le re me rappelle plus!,food offerings and price,30,lunch  ,"la cabane des robinson, alice's curious labyrinth",buzz lightyear,autopia,pirates of the carribean,35,male,no,no,never,does not apply did not have a plan,,yes,"alice's curious labyrinth, pirates of the carribean, la cabane des robinson",no,,,,no,,,pricisions restaurant. age/attractions
206,19:15:00,4/23/2011,7,7,7,4,7,1,No,,No,,No,Manque de temps,Very Good,"Utile, agriable, jei a developper",My group has not purchased any merchandise at the Disneyland Paris Resort Today,,,My group did not purchase any meals or snacks at the Disneyland Paris Resort Today,Wait time,,Lunch,"Its a small world, Art of disney animation, Stitch live, studio tram tour cinemagique, rock n roller coaster, tower of terror, playhouse disney live on stage",,,,34,F,No,No,Once,Does not apply did not have a plan,Long waits,No,,Yes,tower of terror,Yes,,No,,,
206,19:30:00,4/28/2011,7,6,0,3,0,5,Yes,Mire en reille,Yes,,No,, Very good,,Plaza West Shop,Proximity and weather conditions,23,Buzz Lightyear,,12,Afternoon snack,"Le pays des contes de fees, its a small world",Buzz Lightyear ,Its a small world,,11,Male,No,No,Never,loosely,Long waits  ,No,,Yes,Star tours,Yes, ,No,,,
