Device,Time,Date,(1) Map,(1) Waits,(1) Shows,(1) Tips,(1) Bonus,(1) Game,(2) Not work as expected?,If yes...,(3) Influence?,If yes...,(4) Enough time?,If no...,(5) Overall Experience,(5a) Why?,(6) Merchandise Locations,(6a) What drove decision?,(7) Amount on merchandise,(8) F&B Locations,(8a) What drove decisions?,(9) Amount on F&B,(10) Meals eaten,(11) Attractions visisted,(13) Experience #1,(13) Experience #2,(13) Experience #3,(14) Age of user,(14) Gender of user,(15) Paper map?,(16) Paper schedule?,(17) Get lost?,(18) How closely did you follow plan?,(18a) What diverted original plans?,(19) Ride because of low wait times?,(19a) If yes....,(20) Get fast passes?,(20a) If yes...,(20c) Use them?,(20c) If no...,(21) Group split?,(21a) If yes...,(21b) Who kept the device?,(22) Other comments?
118,20:40:00,4/24/2011,7,7,7,4,0,0,no,,yes,autopia/ small worldly pirates carribe,no,,very good,due to save time,My group has not purchased any merchandise at the Disneyland Paris Resort today,,,"Au chalet de la marionette, Pizzeria bella notte",wait times and proximity,20,lunch and afternoon snack,"la cabane des robinson, le pays des contes de fees, alice's curious labyrinth, its a small world, captain EO, stitch live, flying carpets over agrabah",Buzz lightyear,its a small world,,12,Female,no,yes,never,closely,long waits,yes,"Its a small world, Pirates of the carribean, carrousel",yes,buzz lightyear and peter pan,yes,,yes,age of children,children,none
118,19:42:00,4/25/2011,7,7,4,0,3,4,No,,Yes,Waiting times,No,,Very Good,Easy to use,The emporium,Store look and feel,30,My group has not purchased any meals or snacks at the Disneyland Paris Resort today,,,,"La cabane des robinson, le pays des contes de fees, alice's curious labyrinth, its a small world, flying carpets over agrabah, studio tram tour, armageddon, rock n roller coaster",Crush's coaster,rock n roller coaster,big thunder mountain,26,Male,No,No,Never,Does not apply did not have a plan,,Yes,Snow White,Yes,"Big thunder mountain, buzz lightyear, rock n roller coaster",Yes,,Yes,Enfant etant trop petit pour certain attractions,Me,Device should indicate attraction failure for long period
118,20:15:00,4/26/2011,7,7,7,7,7,7,No,,Yes,,no,,Excellent,,Walt Disney Studio Store,Proximity,100,Restaurant en Coulisse,Proximity,50,Lunch and afternoon snack,"Le pays des contes de fees, Its a small world, Art of Disney Animation, Stitch live, Flying carpets over agrabah, Cinemagique, Moteurs action stunt show, playhouse Disney live on stage",Moteurs action stunt show,star wars,Le pays des contes de fees,40,Female,yes,yes,never,closely,long waits,yes,Its a small world,no,,,,no,,,
118,19:28:00,4/29/2011,7,7,7,3,5,4,No,,yes,,no,,Excellent,,My group has not purchased any merchandise at the Disneyland Paris Resort today,,0,Cowboy Cookout bbq,counter service vs table service,30,Lunch,"La cabane des robinson, Le pays des contes de fees, Alice's Curious Labyrinth,Its a small world",Its a small world,pluto,,40,Male,Yes,No,Never,not at all,long waits,yes,,no,,,,No,,,
118,18:10:00,4/30/2011,6,7,6,6,6,5,No,,No,,No,,Good,,Indiana Jones Adventure Outpost,Proximity,20,My group did not purchase any meals or snacks at the Disneyland Paris Resort this trip,Proximity,,,"Alice's Curious Labyrinth, its a small world",Space Mountain,Train de ?,Its a small World,17,F,Yes,Yes,No,Never,Does not apply,No,,No,,No,,No,,,Fratique
118,16:35:00,4/27/2011,6,6,6,5,2,0,yes,,yes,,no,Nobody here in RDV for the bonuses,good,,My group has not purchased any merchandise at the Disneyland Paris Resort today,,,My group has not purchased any meals or snacks at the Disneyland paris resort today,wait times and bonuses,,,,,,,,,,,,,,,,,,,,,,,could not finish because they were late for the train
118,13:38:00,4/22/2011,7,1,3,5,2,7,yes,It didn't show our location,no,,no,,excellent,,"The Emporium, walt disney studios store, les legends de hollywood, tower hotel gifts, art of animation", ,1000,,,,,,,,,,,,,,,,,,,,,,,,,
119,21:40:00,4/23/2011,7,5,?,?,5,?,No,,No,,No,,Very good,?,My group has not purchased any merchandise at the Disneyland Paris Resort today.,,,My group has not bought food today.,,,,"Le Pays des Contes de Fees, It's a Small World, Rock 'n' Roller Coaster, Tower of Terror, Moteurs... Action! Stunt Show",Space Mountain 2,Tower of Terror,Rock 'n' Roller Coaster,17,F,Yes,No,Once,Approximately,"long waits, tired children",No,,No,,,,Yes,,,useful but the paper map is more complete. (more details)
119,19:10:00,4/24/2011,7,5,7,4,7,5,no,,yes,,yes,,very good,pratique,"The Emporium, les legends de hollywood, art of animation","merchandise offerings, store look and feel, bonus",50,"Au chalet de la marionette, Pizzeria bella notte, Restaurant en Coulisse",Wait times and bonus,50,lunch and afternoon snack,"its a small world, captain eo, art of disney animation, stitch live, flying carpets over agrabah, armageddon, toer of terror",tower of terror,Stitch live,Armageddon,34,Male,no,no,never,does not apply did not have a plan,,yes,"cars, captain EO and armageddon",yes,"space mountain, peter pan",yes,,yes,Maniq in sensation,momme,experience a prolong
119,19:51:00,4/25/2011,7,7,1,7,7,7,No,,Yes,In case of long waiting,Yes, ,Excellent,It helped me plan my visit,"Indiana Jones Adventure outpost, Tower hotel gifts and Disney store",Merchandise offerings,80,My group has not purchased any meals or snacks at the Disneyland Paris Resort today,,, ,,Tower of terror,rock n roller coaster,RC Racer,25,Male,Yes,No,Never,Does not apply did not have a plan,Long waits,No,,Yes,,,,No,,,Is a very useful and good device
119,17:05:00,4/27/2011,6,5,3,1,0,2,yes,"no toilets o map, hard to find wait times in list",no,,no,no bonuses received,good,Several improvements to info could be made,"Walt Disney Studio store, disney store","store look and fel, proximity",90,Cafe Hyperion,Food offerings and price,80,lunch,"its a small world, studio tram tour, armageddon, playhouse disney live on stage",Studio tram tour,playhouse disney live,armageddon,31,male,yes,yes,never,loosely,tired children,no,,no,,,,no,,"Screen hard to see in sunlight, battery died",
120,17:35:00,4/25/2011,7,3,6,4,6,3,No,,No,,Yes,,Very Good,Simple to use and can plan visit,,,,"Colonel Hathis Pizza Outpost, Cowboy Cookout BBQ ","Food offerings, wait times, bonus",100,"Breakfast, morning snack and dinner","Its a small world, stitch live, studio tram tour, cinemagique, moteurs action stunt show",Moteurs action stunt show,rock n roller coaster,studio tram tour,39,Male,No,No,Never,Closely,Long waits,Yes,Magic wand,Yes,roller coaster and tower of terror,No,,No,,,
120,20:55:00,4/26/2011,6,5,5,5,5,5,No,,no,,yes,,good,,My group has not purchased any merchandise at the Disneyland Paris Resort today,,,My group has not purchased any meals or snacks at the Disneyland Paris Resort today,Wait times,10,,"Les cabane des robinson, Its a small world, art of dinsey animation, cinemagique, playhouse disney live on stage",Railroad,Armageddon,Its a small world,"6,10,38,40",,yes,no,a few times,exactly,long waits,no,,no,,no,,no,,,
120,19:37:00,4/29/2011,7,5,5,2,3,4,no,,yes,,yes,,Very Good,Pratique,My group has not purchased any merchandise at the Disneyland Paris Resort today,,,,"Food offerings, wait times",40,lunch and afternoon snack,"Alic'es Curious Labyrinth, Captain EO, Studio Tram Tour, Cinemagique, Rock n roller coaster, Tower of terror",Tower of terror,rock n roller coaster,,9,Female,No,No,Never,Does not apply did not have a plan,Long waits,Yes,Captain EO,No,,,,No,,,Bon outil a generauser
120,17:07:00,4/30/2011,,,,,,,,,,,,,,,,,,,,,,,,,,,,,,,,,,,,,,,,,,
120,17:45:00,4/22/2011,0,4,0,4,4,6,no,,yes,,yes,,good,info pas oi jour,My group has not purchased any merchandise at the disneyland paris resort today,,,cafe hyperion,proximity,45,lunch  ,its a small world,pirates of the carribean,big thunder mountain railroad,buzz lightyear,10,Male,Yes,no,never,closely,long waits,yes,star tours,yes,buzz lightyear and big thunder mountain railroad,no, pamme du train,no,,,bien mais pos a jour
121,19:28:00,4/26/2011,4,5,2,3,6,5,no,,yes,,yes,,Very Good,je mio tres satisfied,My group has not purchased any merchandise at the Disneyland Paris Resort today,,,Cafe Hyperion,Food offerings,25,Lunch,"Studio tram tour, rock n roller coaster, tower of terror",Crush's Coaster,Space Mountain,Rock n Roller Coaster,20,Female,yes,yes,never,closely,Long waits and bonus,yes,,,,yes,,no,,,Fast Pas mi cappareil...(poo su papeir)
121,19:00:00,4/29/2011,6,3,6,5,5,1,Yes,,No,,Yes,,Just Okay,,"Walt Disney Studio store, art of animation",Store look and feel and other,20,Restaurant en coulisse,Bonus,50,Breakfast and morning snack,"Art of disney animation, cinemagique, rock n roller coaster, tower of terror",Tower of terror,Animagique,Cinemagique,35,Female,No,No,Never,loosely,Long waits,yes,rock n roller coaster,no,,,,no,,,Not all of the people know the device so they have to ask their dirctions. We don't get fast passes. why?
121,18:30:00,4/27/2011,5,5,6,3,3,3,no,,yes,wait times,no,,very Good,useful especially when it is your first visit in Disneyland,,Store look and feel,30,My group has not purchased any meals or snacks at the Disneyland paris resort today,Wait times  ,40,Lunch,"rock n roller coaster, moteurs action stunt show, playhouse disney live",rock n roller coaster,armageddon,car,33,female,yes,no,never,does not apply did not have a plan,,yes,zigzag,yes,rock n roller coaster,yes, ,yes,age,,
123,15:35:00,4/25/2011,7,7,7,7,7,7,No,,Yes,,No,,Very Good,Is useful,The emporium,Merchandise offerings and store look and feel,200,Buzz lightyears pizza planet,Food offerings and price,80,Lunch,La cabane des robinson,Buzz lightyear,Tasse,Pays de contes de fees,"33,38,66",Male and female,Yes,Yes,Never,Exactly,Long waits,Yes,Carroussel,No,,Yes,,No,,,
124,20:30:00,4/23/2011,7,7,3,4,3,4,No,,Yes,,No,,Good,good manipulation,,"the look and feel of the store, the proximity",2001,My group has not bought food today.,,,,"La Cabane de Robinson, It's a Small World",?,Big Thunder,Small World,,,Yes,No,Sometimes,No plan,long waits,Yes,Cabane de Robinson,,,,,,,,We ???? one hour waiting in an attractionbecause of a failure. It will be be interesting to integrate that kind of information.
124,19:50:00,4/24/2011,3,4,3,0,5,2,yes,screen sometimes too dark to read,yes,wait times indicated as shorter so chandged location,no,waiting on defect attraction to long :-(,good,"improvements could be: earphones-cannot realize always when news arrives, occupied with attractions. Neck holder",Plaza west shop Walt Disney studios store,"merchandise offerings, bonus",150,Restaurant Hakuna Matata and Disney's Blockbuster cafe,Other-We were there and happy,200,"Morning snack, luch, and afternoon snack","le pays des contes de fees, art of Disney animation, flying carpets over agrabah, cinemagique",Meet Characters,Tic Tac,"Circus train beside ""fees""",7,Female,yes,no,once,does not apply did not have a plan,,yes,flying carpets,no,,,,no,,,"put an earphone on it or a neckholder, screen sometimes too dark to see, an option to get tips what attraction is near for 7 year old childs or not too fast rides could be usful"
124,20:45:00,4/25/2011,6,6,0,3,7,7,No,,Yes,,Yes,,Very Good,Useful,My group has not purchased any merchandise at the Disneyland paris resort today,Merchandise offerings and store look and feel,,My group has not purchased any meals or snacks at the Disneyland Paris Resort today,,,afternoon snack,"Captain EO, Art of dinsey animation, studio tram tour, moteurs action stunt show",studio tram tour,art of dinsey animation,buzz lightyear,22,Female,Yes,No,Never,Loosely,Long waits,Yes,armageddon art of disney and star tour,No,,,,No,,,Nothing to say
124,18:30:00,4/26/2011,5,5,3,4,4,3,no,,yes,,yes,,good,,La girafe couleuse,Store look and feel,30,My group has not purchased any meals or snacks at the Disneyland Paris Resort today,Proximity,20,Afternoon snack,"Its a small world, rock n roller coaster, tower of terror, moteurs action stunt show",,Town,Space Mountain,16,Female,yes,yes,never,Does not apply did not have a plan,Long waits,no,,no,,no,,yes,,Moi,
124,18:47:00,4/28/2011,7,7,5,2,0,0,No,,Yes,,No,,Good,utile cur temps d'attente,"Indiana Jones adventure Outpost, Plaza West shop, Thunder Mesa Mountain","Merchandise Offerings, Store look and feel, proximity",60,Cafe Hyperion,,,,,,,,,,,,,,,,,,,,,,,,
124,20:30:00,4/29/2011,7,7,6,5,4,2,No,,No,,No,,Very Good,Pratique,"Indiana Jones adventure outpost. Walt Disney Studio store, World of toys, Disney Store",Merchandise offering and Store look and feel,80,Pizzeria Bella Notte,Wait times,38,Lunch,"Le pays des contes de fees, Alice's curious labyrinth, its a small world, Art of Disney animation, Flying Carets over agrabah, Cinemagique, Playhouse disney live on stage",Tapis volinta,Djamba,,35,Female,No,no,Never,Closely,Tired children,No,,No,,No,,No,,,Excellent
124,18:25:00,4/30/2011,4,5,5,3,6,3,No,,Yes,,Yes,,Excellent,The etele,My group has not purchased any merchandise at the Disneyland Paris Resort Today,,,"Buzz Lightyears Pizza Planet, Cafe Hyperion",Price and Bonus,100,"Lunch, afternoon snack and dinner","Le pays des contes de fees, its a small world, Captain EO, Stitch Live, Flying carpets over agrabah, studio tram tour, playhouse disney live on stage",It's a small world,Dumbo,stitch,29,F,Yes,Yes,Never,Does not apply _ did not have a plan,Long Waits,Yes,Captain EO,Yes,Buzz Lightyear,Yes,No,,,,R A S
124,19:30:00,4/27/2011,7,7,6,5,5,4,yes,Some mistakes,yes,,yes,,very Good,perfecible,My group has not purchased any merchandise at the disneyland paris resort today,,,My group has not purchased any meals or snacks at the Disneyland paris resort today,,,Lunch,"Art of disney animation, flying carpets over agrabah, studio tram tour, cinemagique, armageddon, rock n roller coaster, tower of terror, moteurs action stunt show",Moteurs action stunt show,rock n roller coaster,tower of terror,33,Male,no,no,never,does not apply did not have a plan,long waits,yes,armageddon,yes,rock n roller coaster,yes,,no,,,"list of attractions by parks, one bonus came too late"
125,,4/23/2011,6,3,2,2,3,7,No,,No,,No,,Very good,,My group has not purchased any merchandise at the Disneyland Paris Resort today.,,,Gold Fountain Restaurant,,,,,,,,,,,,,,,,,,,,,,,,
125,19:30:00,4/24/2011,7,7,5,5,7,3,No,,yes,,yes,,excellent,ideal,plaza west shop,merchandise offerings,150,My group has not purchased any meals or snacks at the Disneyland Paris Resort today,,,,"Armageddon, Rock n roller coaster, tower of terror",tower of terror,Rock n roller coaster,Space Mountain,21,Male,no,no,never,loosely,long waits,no,,no,,no,,yes,temps d'attente,moi et autre,excellent a mettre en place a grande echelle 20/20
125,18:32:00,4/25/2011,6,6,0,5,5,5,No,,Yes,Big thunder mountain (Mais eu panne),Yes,Fast pass rock n roller coaster,Good,Should indicate failures,,,0,Restaurant en coulisse,Food offerings,25,Lunch,"Flying carpets over agrabah, studio tram tour, rock n roller coaster, tower of terror",rock n roller coaster,Tower of terror,RC Racer,12,Male,Yes,No,Never,Does not apply did not have a plan,,Yes,"Rock n roller coaster, pirates of the carribean",Yes,Tower of terror and rock n roller coaster,Yes,,No,,,Indicate when an attraction is closed
125,16:30:00,4/28/2011,3,7,7,3,7,1,Yes,"Not everything marked, tips came off screen too quickly",Yes,to reduce wait,Yes,,Very Good,,"The Emporium, Thundermesa Mercantile, La Girafe Curieuse, Walt Disney studio store","Merchandise Offerings, Store look and feel, proximity",200,Colonel Hathi's pizza outpost,"food offerings, bonus",50,Lunch,"Le Pays des contes de fees, Alice's Curious Labyrinth, its a small world, flying carpets over agrabah, studio tram tour, cinemagique, Armageddon, Rock n roller coaster,Tower of terror, moteurs action stunt show, playhouse disney live on stage",,,,38,Female,Yes,Yes,Never,Loosely,Long waits and tired children,No,,Yes,Tower of terror and buzz lightyear,Yes,,Yes,Children tired,Adults with children,None
125,17:35:00,4/29/2011,7,7,7,4,4,5,no,,no,,no,,Very Good,,Les Legends de Hollywood,Proximity,7.95,Restaurant en coulisse,Proximity and price,20,Afternoon snack,"Alic'es Curious Labyrinth, Art f Disney Animation, Studio Tram Tour, Cinemagique, Tower of terror",Cinemagique,Alice's Curious Labyrinth,Its a small world,43,Male,yes,yes,Never,Closely,other - rain,yes,Space mountain,yes,Space Mountain,yes,,Yes,mom went with young children to fantasyland,Dad went with older boy to frontierland,Would love to see restaurants and restrooms on map- and be able to make dining reservations with it.
125,,4/30/2011,5,7,5,5,5,5,No,,No,,No,pos 6 temps,Good,,My group has not purchased any merchandise at the Disneyland Paris Resort Today,,,,,,,,,,,,,,,,,,,,,,,,,,,
125,21:20:00,4/22/2011,7,5,5,4,5,5,no,,yes,,no,,good,,,proximity,70,"Buzz lightyears pizza planet, restaurant hakuna matata",price,100,lunch and dinner,"le pays des contes de fees, captain eo",peter pan,buzz lightyear,pirates of the carribean,33,female,yes,no,never,loosely,long waits,yes,snow white,yes,space mountain,yes,,no,,,
126,20:44:00,4/26/2011,7,5,0,4,5,1,no,,yes,,yes,,good,,The Emporium,Bonus,110,My group has not purchased any meals or snacks at the Disneyland Paris Resort today,,,,"Its a small world, studio tram tour, Moteurs action stunt show",Moteurs action stunt show,Studio tram tour,Buzz lightyear,35,Male,yes,yes,never,loosely,long waits,Yes,its a small world,yes,buzz lightyear,yes,,no,,,
126,19:30:00,4/30/2011,5,0,0,3,4,6,No,,,,Yes,,Good,Map display too small,My group has not purchased any merchandise at the Disneyland Paris Resort Today,,50,My group has not purchased any meals or snacks at Disneyland Paris REsort this trip,,50,Lunch,,,,,"12,13",Male/Female,Yes,No,A few times,Not at all,Long Waits,Yes,,Yes,Buzz Lightyear,No, ,Yes,Different rides,Myself,
126,16:35:00,4/27/2011,7,6,5,1,1,1,no,,yes,,no,,good,,,proximity,17,Fuente del oro restaurante,Food offerings,32,lunch,"la cabane des robinson, le pays des dontes de fees, rock n roller coaster, tower of terror",rock n roller coaster,tower of terror,,40,Male,yes,yes,never,closely,tired children,no,,yes,rock n roller coaster,yes,,yes,for various reasons,the lady,
129,19:23:00,4/26/2011,7,7,7,3,3,1,No,,Yes,Temps,no,,no,Poirs de pile de lery,Thunder Mesa Mercantile,Merchandise offerings,7.5,My group has not purchased any meals or snacks at the Disneyland Paris Resort today,Food offerings,,,Its a small world,Junbo,Snow white, ,31,Female,No,No,Never,Loosely,Long waits,Yes,Alice,No,,,,No,,,
129,20:45:00,4/26/2011,7,4,3,7,6,7,yes,decharge,no,,no,,just okay,,"The Emporium, World of toys","Merchandise offerings, store look and feel",,Colonel Hathi's pizza outpost,Wait times,25,lunch,"Alice's Curious Labyrinth, Armageddon",,,,9,Male,yes,yes,a few times,Does not apply did not have a plan,,no,,no,,,,no,,,
129,19:20:00,4/28/2011,5,7,7,0,0,4,No, ,Yes,,No,Naus interesseg pas,Good,Mauquede de information,Chaumieres des....,"Merchandise offerings, store look and feel ",150,Cowboy cookout barbeque,Reservations,120,Lunch,Stitch Live,Cars,Stitch live,Zig Zag,36,Male,No,No,Never,Does not apply,Long waits  ,Yes,Les Tusses,No,,,,No,,,Manque les restaurants et manque de liens direct ou nuveau des attractions du style temps d attente u'savoir si pain ou fants ou pas
129,16:45:00,4/29/2011,7,7,7,0,5,3,No,,,,Yes,,Excellent,More time to do other attractions,My group has not purchased any merchandise at the Disneyland Paris Resort today,,,Disney Blockbuster cafe,Wait times and price,30,Lunch,"Studio tram tour, Armageddon, tower of terror, moteurs action stunt show",studio tram tour,crush's coaster,tower of terror,38,Male,no,no,Never,Closely,Long waits,no,,no,,,,no,,,very useful
129,,4/30/2011,4,5,3,0,0,4,No,,No,,No,,Good,,,"Store look and feel, proximity",300,,"waiting time, proximity",60,Lunch and afternoon snack,,Buzz Lightyear,Space Mountain,,5,Male,No,No,A few times,Closely,Long Waits,Yes,Dumbo,No,,,,No,,,
129,,,,,,,,,,,,,,,,,,,,,,,,,,,,,,,,,,,,,,,,,,,,No fonctionne que 5 min.
129,20:10:00,4/27/2011,7,7,7,7,7,7,no,,yes,sometimes changed to rides with a shorter wait,no,save messages received too late,very Good,helpful,"Plaza west shop, walt disney studios store",Merchandise offerings and proximity,80,My group has not purchased any meals or snacks at the Disneyland paris resort today,,,,"La cabane des robinson,Its a small world, stitch live, studio tram tour, Moteurs action stunt show",Buzz lightyear,Moteurs action stunt show,Its a small world,10,female,yes,yes,a few times,loosely,long waits and tired children,yes,,no,,,,yes,lots of children and too many rides to acheive in 1 day,,Excellent! To link wait times with ride descriptions and locations
130,14:30:00,4/28/2011,7,7,7,4,0,7,No,,No,,,N/A,Excellent,fur,,,,,,300,"Breakfast, morning snack",Stitch Live,Peter pan,New York ,Fantasy Land,37,Male,Yes,Yes,Never,Closely,Tired children,Yes,Disney express,No,, ,N/A,No,,,Brilliant
130,19:19:00,4/29/2011,,7,4,1,7,2,No,,No,,Yes,fast pass tour de la teneiu,Excellent,,Tower hotel gifts, ,20,"Fuente del oro restaurant, Disney Blockbuster Cafe",Proximity,40,lunch and afternoon snack,"Art of Disney animation, Studio tram tour, armageddon, rock n roller coaster, tower of terror",Tower of terror,rock n roller coaster,Studio tram tour,12,Male,yes,no,Never,Does not apply did not have a plan,,yes,indiana jones,yes,rock n roller coaster and tower of terror,yes,,no,,,none
130,21:30:00,4/30/2011,7,7,6,,,,No,,No,,Yes,,Very Good,,My group has not purchased any merchandise a the Disneyland Paris Resort today,,,Pizzeria Bella Notte,Food Offerings,50,"Lunch, Afternoon snack, and dinner",It's a small world,small world,Space Mountain,Buzz Lightyear,30,F,Yes,Yes,Once,Not at all,Tired Children,Yes,,No,,,,No,,,No
130,19:09:00,4/22/2011,7,7,7,7,7,5,no,,yes,,yes,,very good,facile d'empois,"plaza west shop, tower hotel gifts, disney store",merchandise offerings and store look and feel,300,buzz lightyears pizza planet  ,price and bonus,100,dinner,"Rock n roller coaster, tower of terror, moteurs action stunt show",tower of terror,rock n roller coaster,space mountain,"17, 19",female,no,no,never,closely,long waits,no,,no,,,,no,,,il monque les restaurants
131,,4/24/2011,6,7,4,4,0,5,yes,sometimes it locked,yes,didn't use it,,,Very Good,,"Plaza west shop, Disney Store",Store look and feel,35,My group has not purchased any meals or snacks at the Disneyland Paris Resort today,,50,Afternoon snack and evening snack,"La cabane des robinson, le pays des contes de fees, alice's curious labyrinth, its a small world, stitch live, flying carpets over agrabah, cinemagique",Its a small world,Cinemagique,Le pays des contes de fees,37,Female,yes,no,never,closely,long waits,yes,a lot,yes,peter pan,yes,,no,,,Maybe add toilets! and a cord to hold it.
131,17:00:00,4/28/2011,5,5,6,4,4,4,No,,No,,No,,Very Good,,"Walt Disney studio store, les legends de hollywoood, tower hotel gifts, art of animation, disney store, world of toys",Merchandise offerings,300,Blue dagoon steak house,,,,,,,,,,,,,,,,,,,,,,,,
131,20:45:00,4/30/2011,7,7,4,4,5,1,No,,Yes,,No,,Good,Parque des informations,The Emporium,Other - Souveir pour les enfants,65,Pizzaria bella notte,Other - comile d'erlneperso,bar l pas,Lunch,"Its a small world, alice's curious labyrinth",,,,38,M,No,No,Never,Does not apply- did not have a plan,Long Waits,Yes,,Yes,Buzz,Yes,,No,,,
131,18:05:00,4/22/2011,6,6,6,6,6,6,no,,yes,,yes,,excellent,,plaza west shop  ,weather conditions,20,,reservation,,lunch,"la cabane des robinson, le pays des contes de fees, its a small world, captain eo, studio tram tour, armageddon, rock n roller coaster, moteurs action stunt show",studio tram tour,moteurs action stunt show,rock n roller coaster,32,female,yes,no,never,loosely,long waits,no,,yes,big thunder mountain,,,no,,,
132, ,4/25/2011,6,7,3,6,7,4,no,,yes,,no,,very good,waiting times,Buzz Store,merchandise offerings and store look and feel,200,,,,,,,,,,,,,,,,,,,,,,,,,
132,17:50:00,4/26/2011,6,7,7,7,7,7,no,,yes,,no,,very Good,Utile,My group has not purchased any merchandise at the Disneyland Paris Resort today,,,Au Chalet de la Marionette,,,,"Studio tram tour, Armageddon, rock n roller coaster, tower of terror, Moteurs action stunt show.",Rock n roller coaster,Tower of terror,,"13,11,45,47",female and male,yes,yes,never,Does not apply did not have a plan,bonus,no,,yes,rock n roller coaster,yes,,no,,,
132,19:50:00,4/28/2011,5,4,4,4,4,4,No,Park voille,Yes,temps,No,Trop tard,Good,Manque el info,Les legends de hollywood,Proximity,30,Fuente del oro restaurants,Food offerings,40,Breakfast ,"Le pays des contes de fees, flying carpets over agrabah",Star tour,pirates of the carribean,Space mountan,40,Male,Yes,Yes,Never,Not at all,Long waits and tired children,yes,,Yes,,Yes,,Yes,different motivation,Male,Should have toilet information etc
132,19:10:00,4/30/2011,7,7,7,7,7,7,Yes,Possitior,No, ,No,Pas eu de le for park,Good,,Les Legends de hollywood,Bonus,25,,,,,,,,,,,,,,,,,,,,,,,,,
132,19:30:00,4/27/2011,7,7,5,5,0,4,no,,yes,waiting times,no,,very Good,great idea,my group has not purchased any merchandise at the disneyland paris resort today,,,My group has not purchased any meals or snacks at the Disneyland paris resort today,,,,"la cabane des robinson, le pays des contes de fees, alice's curious labyrinth, its a small world, captain EO",Space mountain,Indiana jones,pirates of the carribean,41,Male,yes,yes,never,closely,long waits and tired children,yes,,yes,space mountain,yes,,yes,age difference,,
132,17:50:00,4/22/2011,7,7,7,0,7,4,yes,Pone tiempo espera o paro no funciona,yes,sacabamos fast pass,yes,,very good,muy util y facil de usar,My group has not purchased any merchandise at the Disneyland Paris Resort Today,,,Buzz Lightyears pizza planet,"proximity, bonus",20,lunch,"its a small world, captain EO",Buzz Lightyear,pirates of the carribean,peter pan,33,Male,yes,yes,never,closely,long waits,,,no,,,,yes,one at Space mountain and the other at pirates of the carribean,,none - muy bueno. Gracias
